{
 "brief_id": "R001-Wire3-Ocala-0921",
 "competitor_comparison_table": [
  {
   "competitor_name": "Wire3",
   "footprint_confirmed_in_region": {
    "value": true,
    "evidence_ids": [
     "EV-d94963c8",
     "EV-da49655b"
    ],
    "basis": "evidence"
   },
   "service_type": {
    "value": "fiber",
    "evidence_ids": [
     "EV-d94963c8",
     "EV-d1118463"
    ],
    "basis": "brief_stated"
   },
   "has_mobile_bundle_available": {
    "value": false,
    "evidence_ids": [],
    "basis": "brief_stated"
   },
   "top_advertised_speed_mbps_down": {
    "value": 10000.0,
    "evidence_ids": [
     "EV-d1118463",
     "EV-37a93029"
    ],
    "basis": "evidence"
   },
   "top_advertised_speed_mbps_up": {
    "value": 10000.0,
    "evidence_ids": [
     "EV-d1118463"
    ],
    "basis": "inference"
   },
   "summary_note": {
    "value": "Wire3 is actively expanding into Marion County (Ocala) and markets fiber tiers from 250 Mbps up to 10 Gbps with streaming bundle promotions and included eero Wi\u2011Fi devices.",
    "evidence_ids": [
     "EV-d94963c8",
     "EV-d1118463",
     "EV-33d161e7",
     "EV-fe02126f"
    ],
    "basis": "evidence"
   }
  },
  {
   "competitor_name": "Spectrum",
   "footprint_confirmed_in_region": {
    "value": true,
    "evidence_ids": [
     "EV-56997533",
     "EV-3c7ea88d"
    ],
    "basis": "evidence"
   },
   "service_type": {
    "value": "cable",
    "evidence_ids": [
     "EV-31d73084",
     "EV-6fcc7888"
    ],
    "basis": "evidence"
   },
   "has_mobile_bundle_available": {
    "value": true,
    "evidence_ids": [
     "EV-33618605",
     "EV-59451b96"
    ],
    "basis": "evidence"
   },
   "top_advertised_speed_mbps_down": {
    "value": 7000.0,
    "evidence_ids": [
     "EV-31d73084",
     "EV-224bf455"
    ],
    "basis": "evidence"
   },
   "top_advertised_speed_mbps_up": {
    "value": 7000.0,
    "evidence_ids": [
     "EV-31d73084"
    ],
    "basis": "evidence"
   },
   "summary_note": {
    "value": "Spectrum (Charter) advertises wide availability in Marion County with multi-gig tiers, promotional first-year pricing, and bundles that include mobile and TV services.",
    "evidence_ids": [
     "EV-56997533",
     "EV-31d73084",
     "EV-acea4159"
    ],
    "basis": "evidence"
   }
  },
  {
   "competitor_name": "AT&T",
   "footprint_confirmed_in_region": {
    "value": true,
    "evidence_ids": [
     "EV-26834797",
     "EV-6016b158"
    ],
    "basis": "evidence"
   },
   "service_type": {
    "value": "fiber",
    "evidence_ids": [
     "EV-91207f04",
     "EV-6016b158"
    ],
    "basis": "evidence"
   },
   "has_mobile_bundle_available": {
    "value": true,
    "evidence_ids": [
     "EV-bf5f8187",
     "EV-3ccb3abd"
    ],
    "basis": "evidence"
   },
   "top_advertised_speed_mbps_down": {
    "value": 5000.0,
    "evidence_ids": [
     "EV-26834797",
     "EV-6016b158"
    ],
    "basis": "evidence"
   },
   "top_advertised_speed_mbps_up": {
    "value": 5000.0,
    "evidence_ids": [
     "EV-6016b158"
    ],
    "basis": "evidence"
   },
   "summary_note": {
    "value": "AT&T offers fiber and fixed-wireless options in the region, markets up to multi-gig speeds (e.g., up to 5,000 Mbps reported in Ocala listings), and promotes first-year fiber pricing on some offers.",
    "evidence_ids": [
     "EV-91207f04",
     "EV-26834797",
     "EV-3ccb3abd"
    ],
    "basis": "evidence"
   }
  },
  {
   "competitor_name": "T-Mobile Home Internet",
   "footprint_confirmed_in_region": {
    "value": true,
    "evidence_ids": [
     "EV-ab4afe18",
     "EV-87cea105"
    ],
    "basis": "evidence"
   },
   "service_type": {
    "value": "fixed_wireless",
    "evidence_ids": [
     "EV-ab4afe18",
     "EV-3a643017"
    ],
    "basis": "evidence"
   },
   "has_mobile_bundle_available": {
    "value": true,
    "evidence_ids": [
     "EV-3a643017",
     "EV-944ad5f5"
    ],
    "basis": "evidence"
   },
   "top_advertised_speed_mbps_down": {
    "value": 2000.0,
    "evidence_ids": [
     "EV-87cea105",
     "EV-7b85fa9b"
    ],
    "basis": "evidence"
   },
   "top_advertised_speed_mbps_up": {
    "value": 2000.0,
    "evidence_ids": [
     "EV-7b85fa9b"
    ],
    "basis": "evidence"
   },
   "summary_note": {
    "value": "T-Mobile sells 5G Home Internet widely and is expanding fiber in select markets; plans range from low-cost fixed-wireless tiers to higher-tier amplified/all-in packages with upgraded gateways.",
    "evidence_ids": [
     "EV-a89f66b2",
     "EV-3a643017",
     "EV-e2957665"
    ],
    "basis": "evidence"
   }
  }
 ],
 "pricing_matrix": [
  {
   "competitor_name": "Spectrum",
   "plan_name": {
    "value": "Spectrum Internet\u00ae 1 Gig (promo)",
    "evidence_ids": [
     "EV-31d73084",
     "EV-2dfb031f"
    ],
    "basis": "evidence"
   },
   "speed_mbps_down": {
    "value": 1000.0,
    "evidence_ids": [
     "EV-31d73084"
    ],
    "basis": "evidence"
   },
   "promo_status": {
    "value": "has_promo",
    "evidence_ids": [
     "EV-31d73084",
     "EV-58fa6c25"
    ],
    "basis": "evidence"
   },
   "promo_price_usd_per_month": {
    "value": 60.0,
    "evidence_ids": [
     "EV-31d73084"
    ],
    "basis": "evidence"
   },
   "promo_duration_months": {
    "value": 12,
    "evidence_ids": [
     "EV-31d73084"
    ],
    "basis": "evidence"
   },
   "post_promo_price_usd_per_month": {
    "value": 100.0,
    "evidence_ids": [
     "EV-2dfb031f",
     "EV-31d73084"
    ],
    "basis": "evidence"
   },
   "blended_12mo_effective_price_usd": {
    "value": 60.0,
    "derived_from_evidence_ids": [
     "EV-31d73084",
     "EV-2dfb031f",
     "EV-58fa6c25"
    ],
    "formula": "((promo_price * promo_duration_months) + (post_promo_price * (12 - promo_duration_months))) / 12"
   }
  },
  {
   "competitor_name": "AT&T",
   "plan_name": {
    "value": "AT&T Fiber 1 Gig (first-year promo)",
    "evidence_ids": [
     "EV-91207f04",
     "EV-2c5212c0"
    ],
    "basis": "evidence"
   },
   "speed_mbps_down": {
    "value": 1000.0,
    "evidence_ids": [
     "EV-91207f04"
    ],
    "basis": "evidence"
   },
   "promo_status": {
    "value": "has_promo",
    "evidence_ids": [
     "EV-91207f04"
    ],
    "basis": "evidence"
   },
   "promo_price_usd_per_month": {
    "value": 50.0,
    "evidence_ids": [
     "EV-91207f04"
    ],
    "basis": "evidence"
   },
   "promo_duration_months": {
    "value": 12,
    "evidence_ids": [
     "EV-91207f04"
    ],
    "basis": "evidence"
   },
   "post_promo_price_usd_per_month": {
    "value": 90.0,
    "evidence_ids": [
     "EV-2c5212c0"
    ],
    "basis": "evidence"
   },
   "blended_12mo_effective_price_usd": {
    "value": 50.0,
    "derived_from_evidence_ids": [
     "EV-91207f04",
     "EV-2c5212c0"
    ],
    "formula": "((promo_price * promo_duration_months) + (post_promo_price * (12 - promo_duration_months))) / 12"
   }
  },
  {
   "competitor_name": "T-Mobile Home Internet",
   "plan_name": {
    "value": "Rely Home Internet (AutoPay & voice discount)",
    "evidence_ids": [
     "EV-a89f66b2",
     "EV-3a643017"
    ],
    "basis": "evidence"
   },
   "speed_mbps_down": {
    "value": 354.0,
    "evidence_ids": [
     "EV-a89f66b2"
    ],
    "basis": "evidence"
   },
   "promo_status": {
    "value": "has_promo",
    "evidence_ids": [
     "EV-89076a03",
     "EV-a89f66b2"
    ],
    "basis": "evidence"
   },
   "promo_price_usd_per_month": {
    "value": 35.0,
    "evidence_ids": [
     "EV-a89f66b2"
    ],
    "basis": "evidence"
   },
   "promo_duration_months": {
    "value": 1,
    "evidence_ids": [],
    "basis": "inference"
   },
   "post_promo_price_usd_per_month": {
    "value": 35.0,
    "evidence_ids": [
     "EV-a89f66b2",
     "EV-89076a03"
    ],
    "basis": "evidence"
   },
   "blended_12mo_effective_price_usd": {
    "value": 35.0,
    "derived_from_evidence_ids": [
     "EV-a89f66b2",
     "EV-89076a03"
    ],
    "formula": "((promo_price * promo_duration_months) + (post_promo_price * (12 - promo_duration_months))) / 12"
   }
  }
 ],
 "product_feature_comparison": [
  {
   "competitor_name": "Wire3",
   "technology_type": {
    "value": "fiber",
    "evidence_ids": [
     "EV-d94963c8",
     "EV-d1118463"
    ],
    "basis": "evidence"
   },
   "symmetric_speeds": {
    "value": true,
    "evidence_ids": [
     "EV-d1118463"
    ],
    "basis": "inference"
   },
   "data_cap_present": {
    "value": false,
    "evidence_ids": [
     "EV-d1118463",
     "EV-fe02126f"
    ],
    "basis": "evidence"
   },
   "wifi_router_included": {
    "value": true,
    "evidence_ids": [
     "EV-33d161e7",
     "EV-d7118dd5"
    ],
    "basis": "evidence"
   },
   "professional_install_included": {
    "value": true,
    "evidence_ids": [
     "EV-fe02126f",
     "EV-fc020f49"
    ],
    "basis": "evidence"
   },
   "self_install_available": {
    "value": true,
    "evidence_ids": [
     "EV-d1118463"
    ],
    "basis": "inference"
   },
   "contract_required": {
    "value": false,
    "evidence_ids": [
     "EV-89785427",
     "EV-019b25db"
    ],
    "basis": "evidence"
   },
   "contract_length_months": {
    "value": null,
    "evidence_ids": [
     "EV-019b25db"
    ],
    "basis": "evidence"
   },
   "customer_support_channels": {
    "value": [
     "phone",
     "online portal",
     "local field technicians"
    ],
    "evidence_ids": [
     "EV-d94963c8",
     "EV-267cec38",
     "EV-beca7d7f"
    ],
    "basis": "evidence"
   },
   "additional_features": [
    {
     "name": "Enhanced Wi\u2011Fi (eero)",
     "field": {
      "value": "Free eero device included with all plans",
      "evidence_ids": [
       "EV-33d161e7",
       "EV-d7118dd5"
      ],
      "basis": "evidence"
     }
    },
    {
     "name": "Total Connect support tiers",
     "field": {
      "value": "Two tiers for ongoing support and security (Total Connect Premium referenced)",
      "evidence_ids": [
       "EV-33d161e7"
      ],
      "basis": "evidence"
     }
    }
   ]
  },
  {